{
  "$schema": "https://json-schema.org/draft/2020-12/schema",
  "$id": "https://confiture.fraiseql.dev/schemas/migrate-up.schema.json",
  "title": "confiture migrate up --format json",
  "description": "Result of applying pending migrations (MigrateUpResult.to_dict). The fraisier migration adapter reads applied[].version to report the new head. A failure that aborts before/within execution emits the error envelope (error-envelope.schema.json) instead of this shape; a partial failure or a requires_superuser halt sets success=false and lists at least one human-readable string in errors.",
  "type": "object",
  "required": [
    "success",
    "applied",
    "skipped",
    "skipped_superuser",
    "pending",
    "errors",
    "total_duration_ms",
    "checksums_verified",
    "dry_run",
    "dry_run_execute",
    "warnings"
  ],
  "additionalProperties": false,
  "if": {
    "properties": {
      "success": {
        "const": false
      }
    }
  },
  "then": {
    "properties": {
      "errors": {
        "minItems": 1
      }
    }
  },
  "properties": {
    "success": {
      "type": "boolean",
      "description": "True when every pending migration applied successfully."
    },
    "applied": {
      "type": "array",
      "description": "Migrations applied by this operation, oldest \u2192 newest.",
      "items": {
        "type": "object",
        "required": [
          "version",
          "name",
          "duration_ms",
          "rows_affected"
        ],
        "additionalProperties": false,
        "properties": {
          "version": {
            "type": "string",
            "description": "Version identifier of the applied migration (the adapter's head revision)."
          },
          "name": {
            "type": "string",
            "description": "Human-readable migration name."
          },
          "duration_ms": {
            "type": "integer",
            "description": "Apply time in milliseconds."
          },
          "rows_affected": {
            "type": "integer",
            "description": "Rows affected by the migration."
          }
        }
      }
    },
    "skipped": {
      "type": "array",
      "items": {
        "type": "string"
      },
      "description": "Versions already applied before this operation (no-op for them)."
    },
    "skipped_superuser": {
      "type": "array",
      "description": "Migrations halted because they declared requires_superuser=True (issue #137).",
      "items": {
        "type": "object",
        "required": [
          "version",
          "name",
          "reason"
        ],
        "additionalProperties": false,
        "properties": {
          "version": {
            "type": "string"
          },
          "name": {
            "type": "string"
          },
          "reason": {
            "type": "string"
          }
        }
      }
    },
    "pending": {
      "type": "array",
      "items": {
        "type": "string"
      },
      "description": "Versions left unapplied (e.g. everything after a superuser halt)."
    },
    "errors": {
      "type": "array",
      "items": {
        "type": "string"
      },
      "description": "Why the run stopped short: never empty when success=false (a failed migration, or the requires_superuser migration a run halted at, with its apply-as remedy and the count left in pending); empty in the happy path."
    },
    "total_duration_ms": {
      "type": "integer",
      "description": "Total apply time in milliseconds across all migrations."
    },
    "checksums_verified": {
      "type": "boolean",
      "description": "True when all previously-applied migration checksums verified before applying."
    },
    "dry_run": {
      "type": "boolean",
      "description": "True when this was a no-SQL dry-run analysis."
    },
    "dry_run_execute": {
      "type": "boolean",
      "description": "True when SQL was executed inside a SAVEPOINT then rolled back (nothing persisted)."
    },
    "warnings": {
      "type": "array",
      "items": {
        "type": "string"
      },
      "description": "Non-fatal warning messages; empty if none."
    },
    "parser": {
      "type": "object",
      "additionalProperties": false,
      "required": [
        "pglast",
        "pg_major"
      ],
      "description": "What parsed the SQL behind this payload (0.50.0): the installed pglast release and the PostgreSQL grammar major it embeds.",
      "properties": {
        "pglast": {
          "type": "string"
        },
        "pg_major": {
          "type": "integer"
        }
      }
    },
    "ok": {
      "type": "boolean",
      "const": true,
      "description": "The envelope (1.16.0): the command produced this report. What the report found is in its own fields; a command that could not produce one writes the error envelope, where ok is false."
    },
    "command": {
      "type": "string",
      "description": "The envelope (1.16.0): the command that wrote this payload, as typed after `confiture` (`migrate up`, `lint`)."
    }
  }
}
